{
  "name": "ALEXANDER L. MURRAY",
  "title": "FULLSTACK DEVELOPER",
  "contact": {
    "email": "alex.murray.dev@example.com",
    "phone": "555-842-1397",
    "github": "alxmurray"
  },
  "education": [
    {
      "institution": "Pacific Coast Institute of Technology",
      "degree": "Bachelor of Computer Science",
      "duration": "2020 - 2024",
      "details": "Final year undergraduate. GPA: 3.85/4.0. Deanâ€™s List for 3 consecutive semesters."
    },
    {
      "institution": "Northview Science and Mathematics Academy",
      "degree": "Mathematics Specialization",
      "duration": "2017 - 2020",
      "details": ""
    }
  ],
  "skills": {
    "languages": "Java, Python, TypeScript, HTML/CSS",
    "frameworks": "Spring Boot, Hibernate, Spring Security, Docker, AWS (EC2, Lambda, S3), Kafka, RabbitMQ, Quarkus, NestJS, Next.js, Angular, Tailwind",
    "databases": "MySQL, PostgreSQL, MongoDB, Firebase",
    "sourceManagement": "Git, GitLab, Jira",
    "english": "940 TOEIC",
    "others": "Linux user"
  },
  "experience": [
    {
      "role": "FullStack Developer",
      "company": "TechNova Solutions",
      "duration": "01/2025 - Now",
      "responsibilities": [
        "Developed modular UI components with Ant Design and custom styling for enhanced usability.",
        "Added microservices to the API Gateway and integrated endpoints with the frontend.",
        "Implemented a collaborative document-sharing feature for real-time editing.",
        "Conducted research on integrating LLM-powered chatbots for customer service automation."
      ],
      "techStack": "Microservices, Spring Boot, Quarkus, NestJS, React, TypeScript"
    },
    {
      "role": "FullStack Developer",
      "company": "TechNova Solutions",
      "duration": "01/2025 - Now",
      "responsibilities": [
        "Developed modular UI components with Ant Design and custom styling for enhanced usability.",
        "Added microservices to the API Gateway and integrated endpoints with the frontend.",
        "Implemented a collaborative document-sharing feature for real-time editing.",
        "Conducted research on integrating LLM-powered chatbots for customer service automation."
      ],
      "techStack": "Microservices, Spring Boot, Quarkus, NestJS, React, TypeScript"
    },
    {
      "role": "Backend Engineer",
      "company": "BrightAI Labs",
      "duration": "06/2024 - 12/2024",
      "responsibilities": [
        "Designed APIs to handle high-volume transaction processing.",
        "Built serverless functions for automated report generation using AWS Lambda.",
        "Integrated WebSocket communication for real-time data updates.",
        "Collaborated with data scientists to deploy AI models into production."
      ],
      "techStack": "AWS Lambda, Node.js, NestJS, PostgreSQL"
    }
  ],
  "projects": [
    {
      "name": "Freelance Marketplace Platform",
      "isPersonal": true,
      "responsibilities": [
        "Implemented a secure authentication system with JWT and OAuth2.",
        "Built a bidding system for project proposals.",
        "Integrated messaging service with email notifications.",
        "Designed skill-based matching algorithm for clients and freelancers.",
        "Developed a dashboard for freelancers to track project deadlines."
      ],
      "techStack": "PostgreSQL, RabbitMQ, Docker, Spring Boot, JWT"
    }
  ]
}
